{
  "$schema": "http://json-schema.org/draft-07/schema#",
  "$id": "https://agentplane.org/schemas/pr-meta.schema.json",
  "title": "PR artifact meta.json (v1)",
  "type": "object",
  "properties": {
    "schema_version": {
      "type": "number",
      "const": 1
    },
    "task_id": {
      "type": "string",
      "minLength": 1
    },
    "related_task_ids": {
      "type": "array",
      "items": {
        "type": "string",
        "minLength": 1
      }
    },
    "batch": {
      "type": "object",
      "properties": {
        "schema_version": {
          "type": "number",
          "const": 1
        },
        "primary_task_id": {
          "type": "string",
          "minLength": 1
        },
        "included_task_ids": {
          "minItems": 1,
          "type": "array",
          "items": {
            "type": "string",
            "minLength": 1
          }
        },
        "closure_policy": {
          "type": "string",
          "enum": ["all_or_fail"]
        }
      },
      "required": ["schema_version", "primary_task_id", "included_task_ids", "closure_policy"],
      "additionalProperties": false
    },
    "branch": {
      "type": "string",
      "minLength": 1
    },
    "base": {
      "type": "string",
      "minLength": 1
    },
    "pr_number": {
      "type": "integer",
      "minimum": 1,
      "maximum": 9007199254740991
    },
    "pr_url": {
      "type": "string",
      "minLength": 1
    },
    "provider": {
      "type": "object",
      "properties": {
        "schema_version": {
          "type": "number",
          "const": 1
        },
        "kind": {
          "type": "string",
          "enum": ["github", "gitlab"]
        },
        "hostname": {
          "type": "string",
          "minLength": 1
        },
        "remote": {
          "type": "string",
          "minLength": 1
        },
        "source_project": {
          "type": "string",
          "minLength": 1
        },
        "target_project": {
          "type": "string",
          "minLength": 1
        }
      },
      "required": [
        "schema_version",
        "kind",
        "hostname",
        "remote",
        "source_project",
        "target_project"
      ],
      "additionalProperties": false
    },
    "adoption": {
      "type": "object",
      "properties": {
        "schema_version": {
          "type": "number",
          "const": 1
        },
        "task_id": {
          "type": "string",
          "minLength": 1
        },
        "provider": {
          "type": "string",
          "enum": ["github", "gitlab"]
        },
        "hostname": {
          "type": "string",
          "minLength": 1
        },
        "remote": {
          "type": "string",
          "minLength": 1
        },
        "source_project": {
          "type": "string",
          "minLength": 1
        },
        "target_project": {
          "type": "string",
          "minLength": 1
        },
        "pr_number": {
          "type": "integer",
          "exclusiveMinimum": 0,
          "maximum": 9007199254740991
        },
        "head_ref": {
          "type": "string",
          "minLength": 1
        },
        "base_ref": {
          "type": "string",
          "minLength": 1
        },
        "head_sha": {
          "type": "string",
          "pattern": "^[0-9a-f]{40,64}$"
        },
        "base_sha": {
          "type": "string",
          "pattern": "^[0-9a-f]{40,64}$"
        },
        "observed_at": {
          "type": "string",
          "format": "date-time",
          "pattern": "^(?:(?:\\d\\d[2468][048]|\\d\\d[13579][26]|\\d\\d0[48]|[02468][048]00|[13579][26]00)-02-29|\\d{4}-(?:(?:0[13578]|1[02])-(?:0[1-9]|[12]\\d|3[01])|(?:0[469]|11)-(?:0[1-9]|[12]\\d|30)|(?:02)-(?:0[1-9]|1\\d|2[0-8])))T(?:(?:[01]\\d|2[0-3]):[0-5]\\d(?::[0-5]\\d(?:\\.\\d+)?)?(?:Z|([+-](?:[01]\\d|2[0-3]):[0-5]\\d)))$"
        },
        "readback_digest": {
          "type": "string",
          "pattern": "^sha256:[0-9a-f]{64}$"
        },
        "authority_digest": {
          "type": "string",
          "pattern": "^sha256:[0-9a-f]{64}$"
        }
      },
      "required": [
        "schema_version",
        "task_id",
        "provider",
        "hostname",
        "remote",
        "source_project",
        "target_project",
        "pr_number",
        "head_ref",
        "base_ref",
        "head_sha",
        "base_sha",
        "observed_at",
        "readback_digest",
        "authority_digest"
      ],
      "additionalProperties": false
    },
    "created_at": {
      "type": "string",
      "format": "date-time",
      "pattern": "^(?:(?:\\d\\d[2468][048]|\\d\\d[13579][26]|\\d\\d0[48]|[02468][048]00|[13579][26]00)-02-29|\\d{4}-(?:(?:0[13578]|1[02])-(?:0[1-9]|[12]\\d|3[01])|(?:0[469]|11)-(?:0[1-9]|[12]\\d|30)|(?:02)-(?:0[1-9]|1\\d|2[0-8])))T(?:(?:[01]\\d|2[0-3]):[0-5]\\d(?::[0-5]\\d(?:\\.\\d+)?)?(?:Z|([+-](?:[01]\\d|2[0-3]):[0-5]\\d)))$"
    },
    "updated_at": {
      "type": "string",
      "format": "date-time",
      "pattern": "^(?:(?:\\d\\d[2468][048]|\\d\\d[13579][26]|\\d\\d0[48]|[02468][048]00|[13579][26]00)-02-29|\\d{4}-(?:(?:0[13578]|1[02])-(?:0[1-9]|[12]\\d|3[01])|(?:0[469]|11)-(?:0[1-9]|[12]\\d|30)|(?:02)-(?:0[1-9]|1\\d|2[0-8])))T(?:(?:[01]\\d|2[0-3]):[0-5]\\d(?::[0-5]\\d(?:\\.\\d+)?)?(?:Z|([+-](?:[01]\\d|2[0-3]):[0-5]\\d)))$"
    },
    "status": {
      "type": "string",
      "enum": ["OPEN", "CLOSED", "MERGED"]
    },
    "artifact_state": {
      "type": "string",
      "enum": ["open", "merged", "handoff", "remote_staged", "remote_failed"]
    },
    "artifact_state_reason": {
      "type": "string",
      "minLength": 1
    },
    "artifact_state_updated_at": {
      "type": "string",
      "format": "date-time",
      "pattern": "^(?:(?:\\d\\d[2468][048]|\\d\\d[13579][26]|\\d\\d0[48]|[02468][048]00|[13579][26]00)-02-29|\\d{4}-(?:(?:0[13578]|1[02])-(?:0[1-9]|[12]\\d|3[01])|(?:0[469]|11)-(?:0[1-9]|[12]\\d|30)|(?:02)-(?:0[1-9]|1\\d|2[0-8])))T(?:(?:[01]\\d|2[0-3]):[0-5]\\d(?::[0-5]\\d(?:\\.\\d+)?)?(?:Z|([+-](?:[01]\\d|2[0-3]):[0-5]\\d)))$"
    },
    "merge_strategy": {
      "type": "string",
      "enum": ["squash", "merge", "rebase"]
    },
    "merged_at": {
      "type": "string",
      "format": "date-time",
      "pattern": "^(?:(?:\\d\\d[2468][048]|\\d\\d[13579][26]|\\d\\d0[48]|[02468][048]00|[13579][26]00)-02-29|\\d{4}-(?:(?:0[13578]|1[02])-(?:0[1-9]|[12]\\d|3[01])|(?:0[469]|11)-(?:0[1-9]|[12]\\d|30)|(?:02)-(?:0[1-9]|1\\d|2[0-8])))T(?:(?:[01]\\d|2[0-3]):[0-5]\\d(?::[0-5]\\d(?:\\.\\d+)?)?(?:Z|([+-](?:[01]\\d|2[0-3]):[0-5]\\d)))$"
    },
    "merge_commit": {
      "type": "string",
      "minLength": 1
    },
    "head_sha": {
      "type": "string",
      "minLength": 1
    },
    "last_verified_sha": {
      "anyOf": [
        {
          "type": "string",
          "minLength": 7
        },
        {
          "type": "null"
        }
      ]
    },
    "last_verified_at": {
      "anyOf": [
        {
          "type": "string",
          "format": "date-time",
          "pattern": "^(?:(?:\\d\\d[2468][048]|\\d\\d[13579][26]|\\d\\d0[48]|[02468][048]00|[13579][26]00)-02-29|\\d{4}-(?:(?:0[13578]|1[02])-(?:0[1-9]|[12]\\d|3[01])|(?:0[469]|11)-(?:0[1-9]|[12]\\d|30)|(?:02)-(?:0[1-9]|1\\d|2[0-8])))T(?:(?:[01]\\d|2[0-3]):[0-5]\\d(?::[0-5]\\d(?:\\.\\d+)?)?(?:Z|([+-](?:[01]\\d|2[0-3]):[0-5]\\d)))$"
        },
        {
          "type": "null"
        }
      ]
    },
    "verify": {
      "type": "object",
      "properties": {
        "status": {
          "type": "string",
          "enum": ["pass", "fail", "skipped"]
        },
        "command": {
          "type": "string"
        }
      },
      "additionalProperties": {}
    }
  },
  "required": ["schema_version", "task_id", "created_at", "updated_at"],
  "additionalProperties": {}
}
