{
  "artifact_state": "merged",
  "artifact_state_updated_at": "2026-05-05T00:16:59Z",
  "base": "main",
  "branch": "task/202605042118-7F28YM/bun-patch-release",
  "created_at": "2026-05-04T21:18:40.756Z",
  "head_sha": "cc45b28b88d036853db891a145540df78c5494d3",
  "last_verified_at": "2026-05-05T00:30:22.679Z",
  "last_verified_sha": "cc45b28b88d036853db891a145540df78c5494d3",
  "merge_commit": "a117e4b5bed136a753feb5b11d590518d3161f4a",
  "merge_strategy": "merge",
  "merged_at": "2026-05-05T00:16:59Z",
  "pr_number": 897,
  "pr_url": "https://github.com/basilisk-labs/agentplane/pull/897",
  "schema_version": 1,
  "status": "MERGED",
  "task_id": "202605042118-7F28YM",
  "updated_at": "2026-05-05T00:30:22.704Z",
  "verify": {
    "status": "pass"
  }
}
