{
  "artifact_state": "merged",
  "artifact_state_updated_at": "2026-06-04T05:09:27Z",
  "base": "main",
  "branch": "task/202606032122-5NZZTN/add-actionable-local-fallback-for-unavailable-ta",
  "created_at": "2026-06-04T05:09:27Z",
  "last_verified_at": null,
  "merge_commit": "496e62de9f1b314586cc41bc311ca36dc4135786",
  "merge_strategy": "merge",
  "merged_at": "2026-06-04T05:09:27Z",
  "pr_number": 4425,
  "pr_url": "https://github.com/basilisk-labs/agentplane/pull/4425",
  "schema_version": 1,
  "status": "MERGED",
  "task_id": "202606032122-5NZZTN",
  "updated_at": "2026-06-04T05:09:27Z",
  "verify": {
    "status": "skipped"
  }
}
