{
  "artifact_state": "merged",
  "artifact_state_updated_at": "2026-05-18T05:57:58Z",
  "base": "main",
  "branch": "task/202605180515-4CAK13/fix-open-branch-pr-feedback",
  "created_at": "2026-05-18T05:15:54.501Z",
  "head_sha": "1ddfd6dbbd53f51a85796ffdfdac8b10b0c921bf",
  "last_verified_at": "2026-05-18T05:51:58.510Z",
  "last_verified_sha": "83713612298d846945a99c572f5d4bcb8e9bc40f",
  "merge_commit": "faa03a5e215ffb89e674314d96852355fb2328e2",
  "merge_strategy": "merge",
  "merged_at": "2026-05-18T05:57:58Z",
  "pr_number": 3863,
  "pr_url": "https://github.com/basilisk-labs/agentplane/pull/3863",
  "schema_version": 1,
  "status": "MERGED",
  "task_id": "202605180515-4CAK13",
  "updated_at": "2026-05-18T05:57:58Z",
  "verify": {
    "status": "pass"
  }
}
